{
  "$schema": "https://json-schema.org/draft/2020-12/schema",
  "$id": "https://shuanglv.local/schema/engineering-execution-state/0.5",
  "title": "爽律 Skill 工程执行状态 v0.5",
  "type": "object",
  "additionalProperties": true,
  "required": [
    "schema_version",
    "lead_skill",
    "context",
    "checklist",
    "adversarial_review",
    "current_law_check",
    "external_processing",
    "escalations",
    "output",
    "research",
    "analysis_work",
    "structured_review",
    "traceability",
    "cross_module_execution",
    "strategy_analysis",
    "working_model",
    "capability_resolution"
  ],
  "properties": {
    "schema_version": {
      "enum": [
        "0.1",
        "0.2",
        "0.3",
        "0.4",
        "0.5"
      ]
    },
    "lead_skill": {
      "type": [
        "string",
        "null"
      ]
    },
    "context": {
      "type": "object",
      "required": [
        "important_task",
        "formal_delivery",
        "requires_current_law",
        "sensitive_material",
        "structured_review_required"
      ],
      "properties": {
        "important_task": {
          "type": "boolean"
        },
        "formal_delivery": {
          "type": "boolean"
        },
        "requires_current_law": {
          "type": "boolean"
        },
        "sensitive_material": {
          "type": "boolean"
        },
        "structured_review_required": {
          "type": "boolean"
        },
        "role": {
          "type": [
            "string",
            "null"
          ]
        },
        "stage": {
          "type": [
            "string",
            "null"
          ]
        },
        "input_capability_gap": {
          "type": "boolean"
        },
        "strategy_choice_required": {
          "type": "boolean"
        },
        "cross_module_required": {
          "type": "boolean"
        },
        "working_model_required": {
          "type": "boolean"
        },
        "issue_tree_required": {
          "type": "boolean"
        },
        "review_question_set_required": {
          "type": "boolean"
        },
        "authority_map_required": {
          "type": "boolean"
        },
        "case_matrix_required": {
          "type": "boolean"
        },
        "argument_map_required": {
          "type": "boolean"
        },
        "plan_review_required": {
          "type": "boolean"
        },
        "behavior_contract_required": {
          "type": "boolean"
        },
        "private_knowledge_required": {
          "type": "boolean"
        },
        "professional_legal_source_required": {
          "type": "boolean"
        },
        "need_ocr": {
          "type": "boolean"
        },
        "need_docx": {
          "type": "boolean"
        },
        "need_pdf": {
          "type": "boolean"
        },
        "native_track_changes_required": {
          "type": "boolean"
        },
        "capability_resolution_required": {
          "type": "boolean"
        }
      }
    },
    "checklist": {
      "type": "array",
      "items": {
        "type": "object",
        "required": [
          "id",
          "status"
        ],
        "properties": {
          "id": {
            "type": "string"
          },
          "status": {
            "enum": [
              "PENDING",
              "PASS",
              "FAIL",
              "N/A"
            ]
          },
          "note": {
            "type": [
              "string",
              "null"
            ]
          }
        }
      }
    },
    "adversarial_review": {
      "type": "object",
      "required": [
        "required",
        "status"
      ],
      "properties": {
        "required": {
          "type": "boolean"
        },
        "status": {
          "enum": [
            "NOT_REQUIRED",
            "PENDING",
            "COMPLETE",
            "FAILED"
          ]
        }
      }
    },
    "current_law_check": {
      "type": "object",
      "required": [
        "required",
        "performed"
      ],
      "properties": {
        "required": {
          "type": "boolean"
        },
        "performed": {
          "type": "boolean"
        },
        "sources": {
          "type": "array"
        }
      }
    },
    "external_processing": {
      "type": "object",
      "required": [
        "used",
        "explicit_consent"
      ],
      "properties": {
        "used": {
          "type": "boolean"
        },
        "provider": {
          "type": [
            "string",
            "null"
          ]
        },
        "explicit_consent": {
          "type": "boolean"
        }
      }
    },
    "escalations": {
      "type": "array",
      "items": {
        "type": "object",
        "required": [
          "level",
          "status"
        ],
        "properties": {
          "level": {
            "enum": [
              "A",
              "B",
              "C",
              "D"
            ]
          },
          "status": {
            "enum": [
              "OPEN",
              "RESOLVED",
              "N/A"
            ]
          },
          "decision": {
            "type": [
              "string",
              "null"
            ]
          }
        }
      }
    },
    "output": {
      "type": "object",
      "required": [
        "output_contract_checked"
      ],
      "properties": {
        "output_contract_checked": {
          "type": "boolean"
        },
        "claimed_capabilities": {
          "type": "array",
          "items": {
            "type": "object",
            "properties": {
              "name": {
                "type": "string"
              },
              "status": {
                "enum": [
                  "VERIFIED_SUPPORTED",
                  "SUPPORTED_BUT_UNVERIFIED",
                  "PARTIAL",
                  "UNSUPPORTED",
                  "DOWNGRADED",
                  "BLOCKED"
                ]
              },
              "claimed_as_delivered": {
                "type": "boolean"
              }
            }
          }
        }
      }
    },
    "research": {
      "type": "object",
      "required": [
        "state",
        "unqualified_conclusion"
      ],
      "properties": {
        "state": {
          "enum": [
            "NOT_REQUIRED",
            "SATURATED",
            "INCOMPLETE",
            "BLOCKED",
            "HUMAN_REVIEW_REQUIRED"
          ]
        },
        "unqualified_conclusion": {
          "type": "boolean"
        }
      }
    },
    "materials": {
      "type": "array",
      "items": {
        "type": "object",
        "properties": {
          "name": {
            "type": "string"
          },
          "status": {
            "enum": [
              "RECEIVED",
              "OPENED",
              "REVIEWED",
              "PARTIAL",
              "NOT_REVIEWED",
              "UNREADABLE",
              "MISSING"
            ]
          },
          "review_scope": {
            "type": [
              "string",
              "null"
            ]
          },
          "locator": {
            "type": [
              "string",
              "null"
            ]
          },
          "critical": {
            "type": "boolean"
          }
        }
      }
    },
    "task": {
      "type": [
        "string",
        "null"
      ]
    },
    "analysis_work": {
      "type": "object",
      "required": [
        "required",
        "status",
        "argument_record_count"
      ],
      "properties": {
        "required": {
          "type": "boolean"
        },
        "status": {
          "enum": [
            "NOT_REQUIRED",
            "PENDING",
            "COMPLETE",
            "FAILED"
          ]
        },
        "argument_record_count": {
          "type": "integer",
          "minimum": 0
        }
      }
    },
    "structured_review": {
      "type": "object",
      "required": [
        "required",
        "performed",
        "record_count"
      ],
      "properties": {
        "required": {
          "type": "boolean"
        },
        "performed": {
          "type": "boolean"
        },
        "record_count": {
          "type": "integer",
          "minimum": 0
        },
        "format": {
          "type": [
            "string",
            "null"
          ]
        }
      }
    },
    "traceability": {
      "type": "object",
      "required": [
        "required",
        "status",
        "critical_claim_count",
        "fully_traced_claim_count",
        "inferred_fact_count",
        "inferred_fact_with_basis_count",
        "verified_legal_rule_count",
        "verified_legal_rule_with_pinpoint_count",
        "deliverable_claim_count",
        "deliverable_claim_with_upstream_links_count",
        "substantive_claims_present"
      ],
      "properties": {
        "required": {
          "type": "boolean"
        },
        "status": {
          "enum": [
            "NOT_REQUIRED",
            "PENDING",
            "COMPLETE",
            "FAILED"
          ]
        },
        "critical_claim_count": {
          "type": "integer",
          "minimum": 0
        },
        "fully_traced_claim_count": {
          "type": "integer",
          "minimum": 0
        },
        "untraced_claim_ids": {
          "type": "array",
          "items": {
            "type": "string"
          }
        },
        "inferred_fact_count": {
          "type": "integer",
          "minimum": 0
        },
        "inferred_fact_with_basis_count": {
          "type": "integer",
          "minimum": 0
        },
        "verified_legal_rule_count": {
          "type": "integer",
          "minimum": 0
        },
        "verified_legal_rule_with_pinpoint_count": {
          "type": "integer",
          "minimum": 0
        },
        "deliverable_claim_count": {
          "type": "integer",
          "minimum": 0
        },
        "deliverable_claim_with_upstream_links_count": {
          "type": "integer",
          "minimum": 0
        },
        "substantive_claims_present": {
          "type": "boolean"
        },
        "trace_report_path": {
          "type": [
            "string",
            "null"
          ]
        }
      }
    },
    "cross_module_execution": {
      "type": "object",
      "required": [
        "required",
        "status",
        "research_request_count",
        "research_result_count",
        "option_count",
        "decision_count",
        "open_human_decision_count",
        "adversarial_review_record_count",
        "adversarial_writeback_status",
        "writeback_event_count",
        "open_writeback_count"
      ],
      "properties": {
        "required": {
          "type": "boolean"
        },
        "status": {
          "enum": [
            "NOT_REQUIRED",
            "PENDING",
            "COMPLETE",
            "FAILED"
          ]
        },
        "research_request_count": {
          "type": "integer",
          "minimum": 0
        },
        "research_result_count": {
          "type": "integer",
          "minimum": 0
        },
        "option_count": {
          "type": "integer",
          "minimum": 0
        },
        "decision_count": {
          "type": "integer",
          "minimum": 0
        },
        "open_human_decision_count": {
          "type": "integer",
          "minimum": 0
        },
        "adversarial_review_record_count": {
          "type": "integer",
          "minimum": 0
        },
        "adversarial_writeback_status": {
          "enum": [
            "NOT_REQUIRED",
            "PENDING",
            "COMPLETE_REVISED",
            "COMPLETE_UNCHANGED_WITH_REASON",
            "FAILED"
          ]
        },
        "writeback_event_count": {
          "type": "integer",
          "minimum": 0
        },
        "open_writeback_count": {
          "type": "integer",
          "minimum": 0
        },
        "chain_report_path": {
          "type": [
            "string",
            "null"
          ]
        }
      }
    },
    "strategy_analysis": {
      "type": "object",
      "required": [
        "required",
        "status",
        "option_count",
        "decision_record_count"
      ],
      "properties": {
        "required": {
          "type": "boolean"
        },
        "status": {
          "enum": [
            "NOT_REQUIRED",
            "PENDING",
            "COMPLETE",
            "FAILED"
          ]
        },
        "option_count": {
          "type": "integer",
          "minimum": 0
        },
        "decision_record_count": {
          "type": "integer",
          "minimum": 0
        }
      }
    },
    "working_model": {
      "type": "object",
      "required": [
        "required",
        "status",
        "matter_model_count",
        "task_profile_count",
        "issue_tree_count",
        "review_question_set_count",
        "authority_map_count",
        "case_matrix_count",
        "argument_map_count",
        "plan_review_status",
        "behavior_contract_status",
        "critical_behavior_violation_count"
      ],
      "properties": {
        "required": {
          "type": "boolean"
        },
        "status": {
          "enum": [
            "NOT_REQUIRED",
            "PENDING",
            "COMPLETE",
            "NEEDS_UPDATE",
            "BLOCKED"
          ]
        },
        "matter_model_count": {
          "type": "integer",
          "minimum": 0
        },
        "task_profile_count": {
          "type": "integer",
          "minimum": 0
        },
        "issue_tree_count": {
          "type": "integer",
          "minimum": 0
        },
        "review_question_set_count": {
          "type": "integer",
          "minimum": 0
        },
        "authority_map_count": {
          "type": "integer",
          "minimum": 0
        },
        "case_matrix_count": {
          "type": "integer",
          "minimum": 0
        },
        "argument_map_count": {
          "type": "integer",
          "minimum": 0
        },
        "legal_object_candidate_count": {
          "type": "integer",
          "minimum": 0
        },
        "plan_review_status": {
          "enum": [
            "NOT_REQUIRED",
            "PENDING",
            "APPROVED",
            "APPROVED_WITH_CHANGES",
            "REVISED",
            "REJECTED"
          ]
        },
        "behavior_contract_status": {
          "enum": [
            "NOT_REQUIRED",
            "PENDING",
            "PASS",
            "PASS_WITH_NOTES",
            "BLOCKED"
          ]
        },
        "critical_behavior_violation_count": {
          "type": "integer",
          "minimum": 0
        },
        "model_check_report_path": {
          "type": [
            "string",
            "null"
          ]
        }
      }
    },
    "capability_resolution": {
      "type": "object",
      "required": [
        "required",
        "status",
        "required_count",
        "resolved_count"
      ],
      "properties": {
        "required": {
          "type": "boolean"
        },
        "status": {
          "enum": [
            "NOT_REQUIRED",
            "PENDING",
            "COMPLETE",
            "BLOCKED",
            "DOWNGRADED"
          ]
        },
        "required_count": {
          "type": "integer",
          "minimum": 0
        },
        "resolved_count": {
          "type": "integer",
          "minimum": 0
        },
        "blocked_requirements": {
          "type": "array",
          "items": {
            "type": "string"
          }
        },
        "downgraded_requirements": {
          "type": "array",
          "items": {
            "type": "string"
          }
        },
        "report_path": {
          "type": [
            "string",
            "null"
          ]
        }
      }
    }
  }
}
