{
  "schema_version": "0.5",
  "task": "处理这批刑事控告材料，包含多份合同、聊天记录和流水，需要判断是否报案并核验现行法",
  "lead_skill": "刑事案件办理",
  "context": {
    "role": "刑事控告委托人代理律师",
    "stage": "报案前",
    "important_task": true,
    "formal_delivery": false,
    "requires_current_law": true,
    "sensitive_material": false,
    "input_capability_gap": false,
    "structured_review_required": true,
    "strategy_choice_required": false,
    "cross_module_required": true,
    "working_model_required": true,
    "issue_tree_required": true,
    "review_question_set_required": true,
    "authority_map_required": true,
    "case_matrix_required": false,
    "argument_map_required": false,
    "plan_review_required": false,
    "behavior_contract_required": true,
    "private_knowledge_required": false,
    "professional_legal_source_required": false,
    "need_ocr": false,
    "need_docx": false,
    "need_pdf": false,
    "native_track_changes_required": false,
    "capability_resolution_required": true
  },
  "checklist": [
    {
      "id": "COMMON-ROLE",
      "status": "PENDING",
      "note": null
    },
    {
      "id": "COMMON-MATERIAL",
      "status": "PENDING",
      "note": null
    },
    {
      "id": "COMMON-FACT",
      "status": "PENDING",
      "note": null
    },
    {
      "id": "COMMON-LOCATOR",
      "status": "PENDING",
      "note": null
    },
    {
      "id": "COMMON-PROV",
      "status": "PENDING",
      "note": null
    },
    {
      "id": "COMMON-GAP",
      "status": "PENDING",
      "note": null
    },
    {
      "id": "COMMON-HUMAN",
      "status": "PENDING",
      "note": null
    },
    {
      "id": "COMMON-ANALYSIS",
      "status": "PENDING",
      "note": null
    },
    {
      "id": "COMMON-HANDOFF",
      "status": "PENDING",
      "note": null
    },
    {
      "id": "COMMON-WRITEBACK",
      "status": "PENDING",
      "note": null
    },
    {
      "id": "COMMON-PROFILE",
      "status": "PENDING",
      "note": null
    },
    {
      "id": "COMMON-ISSUETREE",
      "status": "PENDING",
      "note": null
    },
    {
      "id": "COMMON-BEHAVIOR",
      "status": "PENDING",
      "note": null
    },
    {
      "id": "CRIM-ROLE",
      "status": "PENDING",
      "note": null
    },
    {
      "id": "CRIM-STAGE",
      "status": "PENDING",
      "note": null
    },
    {
      "id": "CRIM-URGENT",
      "status": "PENDING",
      "note": null
    },
    {
      "id": "CRIM-PROOF",
      "status": "PENDING",
      "note": null
    },
    {
      "id": "CRIM-ADVERSE",
      "status": "PENDING",
      "note": null
    },
    {
      "id": "CRIM-OFFENSE",
      "status": "PENDING",
      "note": null
    },
    {
      "id": "COND-LAW",
      "status": "PENDING",
      "note": null
    },
    {
      "id": "COND-STRUCTURED-REVIEW",
      "status": "PENDING",
      "note": null
    },
    {
      "id": "COND-IMPORTANT",
      "status": "PENDING",
      "note": null
    },
    {
      "id": "COND-TRACE",
      "status": "PENDING",
      "note": null
    },
    {
      "id": "CRIM-VICTIM",
      "status": "PENDING",
      "note": null
    },
    {
      "id": "CRIM-VICTIM-BOUNDARY",
      "status": "PENDING",
      "note": null
    },
    {
      "id": "CRIM-VICTIM-PROOF",
      "status": "PENDING",
      "note": null
    },
    {
      "id": "CRIM-VICTIM-PROC",
      "status": "PENDING",
      "note": null
    },
    {
      "id": "COND-RESEARCH-HANDOFF",
      "status": "PENDING",
      "note": null
    },
    {
      "id": "COND-CROSS",
      "status": "PENDING",
      "note": null
    },
    {
      "id": "COND-ADV-WRITEBACK",
      "status": "PENDING",
      "note": null
    },
    {
      "id": "COND-REVIEWQ",
      "status": "PENDING",
      "note": null
    },
    {
      "id": "COND-AUTHMAP",
      "status": "PENDING",
      "note": null
    },
    {
      "id": "COND-CAPABILITY",
      "status": "PENDING",
      "note": null
    }
  ],
  "analysis_work": {
    "required": true,
    "status": "PENDING",
    "argument_record_count": 0
  },
  "structured_review": {
    "required": true,
    "performed": false,
    "record_count": 0,
    "format": null
  },
  "cross_module_execution": {
    "required": true,
    "status": "PENDING",
    "research_request_count": 0,
    "research_result_count": 0,
    "option_count": 0,
    "decision_count": 0,
    "open_human_decision_count": 0,
    "adversarial_review_record_count": 0,
    "adversarial_writeback_status": "PENDING",
    "writeback_event_count": 0,
    "open_writeback_count": 0,
    "chain_report_path": null
  },
  "working_model": {
    "required": true,
    "status": "PENDING",
    "matter_model_count": 0,
    "task_profile_count": 0,
    "issue_tree_count": 0,
    "review_question_set_count": 0,
    "authority_map_count": 0,
    "case_matrix_count": 0,
    "argument_map_count": 0,
    "legal_object_candidate_count": 0,
    "plan_review_status": "NOT_REQUIRED",
    "behavior_contract_status": "PENDING",
    "critical_behavior_violation_count": 0,
    "model_check_report_path": null
  },
  "strategy_analysis": {
    "required": false,
    "status": "NOT_REQUIRED",
    "option_count": 0,
    "decision_record_count": 0
  },
  "capability_resolution": {
    "required": true,
    "status": "PENDING",
    "required_count": 0,
    "resolved_count": 0,
    "blocked_requirements": [],
    "downgraded_requirements": [],
    "report_path": null
  },
  "traceability": {
    "required": true,
    "status": "PENDING",
    "critical_claim_count": 0,
    "fully_traced_claim_count": 0,
    "untraced_claim_ids": [],
    "inferred_fact_count": 0,
    "inferred_fact_with_basis_count": 0,
    "verified_legal_rule_count": 0,
    "verified_legal_rule_with_pinpoint_count": 0,
    "deliverable_claim_count": 0,
    "deliverable_claim_with_upstream_links_count": 0,
    "substantive_claims_present": false,
    "trace_report_path": null
  },
  "adversarial_review": {
    "required": true,
    "status": "PENDING"
  },
  "current_law_check": {
    "required": true,
    "performed": false,
    "sources": []
  },
  "external_processing": {
    "used": false,
    "provider": null,
    "explicit_consent": false
  },
  "escalations": [],
  "output": {
    "output_contract_checked": false,
    "claimed_capabilities": []
  },
  "research": {
    "state": "INCOMPLETE",
    "unqualified_conclusion": false
  },
  "materials": []
}
